business_id,name,category,stars,text
MiMRlsXOpHJMSTDAuw8s1w,Su’s Bowl,Chinese,negative,"I want to love this place so badly. I went yesterday and today, getting the minced pork over noodles yesterday and the shanghainese stewed pork today. Even though it was definitely pricey both times, I'm homesick enough for my mom's cooking that I'm more than willing to pay extra for good food. And while both dishes were good, the wait times were more than ridiculous. Today we went and ordered at 5:05 (grantees, pretty soon after they opened) and didn't get our food until 5:50ish despite being the only people waiting. I would have even been okay with it if they'd warned us they had many mobile orders and needed extra time or something, but they seemed more than okay with leaving us standing by the door for almost an hour. I might return one last time to see if it was a fluke of the past couple days, but today was frustrating enough that it's hard for me to return here."
MiMRlsXOpHJMSTDAuw8s1w,Su’s Bowl,Chinese,positive,"This location went through 3 or 4 slightly different versions of Chinese restaurant in the last 5 years.  There were problems with execution, consistency, service, and pace.  Even with those problems, the goal was always the same, provide relatively authentic Chinese food to Chinese students who crave home cooking.  Su's Bowl took the rein from We Cook, trimmed down the menu size, and introduced a couple of Western Chinese dishes in addition to the popular Sichuan cuisine.  I liked the pork burger, a popular Western Chinese street food consisted of tender chopped braised meat in between a thick split griddled pancakes.  The beef noodle soup was a little watery, but the braised beef was cooked to perfection.  The steamed noodle, another common Western Chinese dish was so flavorful and I actually preferred it over the beef noodle soup."
MiMRlsXOpHJMSTDAuw8s1w,Su’s Bowl,Chinese,positive,I haven't been to this location since the other Chinese restaurant was here. They seemed to clean the place up and made the menu more manageable. They kept my favorite dish which is the pig intestines tossed in dry chile pepper. The new manager suggest the hot pepper pork but instead of jalapeños he made it with Serranos which made it much more spicy. Thank you for accommodating my love of spicy food! They also have a buy one get one on Axxess.
MiMRlsXOpHJMSTDAuw8s1w,Su’s Bowl,Chinese,positive,Authentic and delicious food! The noodles had the perfect texture and were super flavorful. The Chinese hamburgers were great as well. Only concern is that the food tends to be on the greasy side Atmosphere is casual and was great for a family lunch!
MiMRlsXOpHJMSTDAuw8s1w,Su’s Bowl,Chinese,negative,"This restaurant is experiencing the same problems as the 3-4 previous Chinese restaurants at this location.  They can't maintain a consistent quality.  The lamb burger was so spicy that you can't taste other flavors.  The pork burger was still pretty good, but there were no cilantro and scallions like last time.  The beef burger was flavored with cumin, but had a too mushy texture.  The steamed noodle wasn't as fresh this time as some of the noodles were hard and dry.  Lastly, the chili oil noodle consisted of 2 very long strands of noodle served with chili oil.  Whatever happened to vegetables, scallions, and cilantro?"
MiMRlsXOpHJMSTDAuw8s1w,Su’s Bowl,Chinese,negative,"Good food, but they never answer their phone. Also, they never have hours posted anywhere, in store or online. It's a shame because they have really good food, but you never know when it's available."
MiMRlsXOpHJMSTDAuw8s1w,Su’s Bowl,Chinese,positive,Best Chinese food in  town. Loved the Mongolian beef and the sizzling pot. The menu might seems confusing but the food are actually really good. They also provide excellent service. Definitely will come again!!
MiMRlsXOpHJMSTDAuw8s1w,Su’s Bowl,Chinese,positive,"First time here! Had the lamb noodle soup and spicy and sour potato. Both were so good!! Loved the 3 different kinds of noodles in the soup (wide, bean, and tofu noodles I think). Highly recommend! My boyfriend from China approves :)"
MiMRlsXOpHJMSTDAuw8s1w,Su’s Bowl,Chinese,positive,"Food here is always yummy.  I've had the mongolian chicken bento, which was delicious, and the potato bell pepper eggplant stir fry, which is my go-to favorite.  Flavorful, fresh, good quality.  A bit more expensive than the competitive takeout asian food, but worth it."
MiMRlsXOpHJMSTDAuw8s1w,Su’s Bowl,Chinese,positive,"A great place for some real Chinese food!
Not over priced. Love the noodles and the Chinese burger."
MiMRlsXOpHJMSTDAuw8s1w,Su’s Bowl,Chinese,positive,"Good food, but they never answer their phone. I have to call multiple times for them to answer and it's quite irritating."
MiMRlsXOpHJMSTDAuw8s1w,Su’s Bowl,Chinese,positive,"I had the spicy squid. I'm a pretty white guy but I like spice, so I was expecting something with maybe some spicy Mayo or whatever, a few pieces of squid, and some rice. I had a date to go on with this new guy so I wanted something that could be a fun talking point. 

It was a talking point alright. 

Five seconds in and it's the spiciest thing I've ever eaten. My entire face burns with the intensity of crunching red-hot coals in the pits of hell. A few minutes in and my tongue goes completely numb. My lips tingle so much they're practically vibrating. My entire body is screaming for help but I dont stop eating this amazing squid. It was fresh, done to perfection, and a good ratio of meat to vegetables. 

Now this guy is being pretty nice about offering me water and whatnot, but I have never looked more unattractive. Snot is drizzling down my face. I'm practically crying. But it's so good I dont stop eating (plus it was kinda expensive and I didnt want to waste it). We're both laughing over this food and I'm trying to offer him some but he's vegetarian. He'll never know how spicy that was, or how good the meal tasted to make me keep eating it even though I was dying. We did not have a second date. Probably because he thinks I'm some sort of culinary masochist. I guess I kind of am."
MiMRlsXOpHJMSTDAuw8s1w,Su’s Bowl,Chinese,negative,"If you are looking for average food that takes forever, messed up dishes and wrong order, and waitresses that ignore you and treat you like an enemy, you got it! No a 'sorry' after missing one dish from our order and keep us waiting for 40 minutes, no Answer until called very loudly, and cursing on us after check out in Chinese. She said something like fucking idiot, can't imagine how such a women full of hatred and zero gratitude can work in a service industry. Would never go again. I mean, one of the drawbacks, bad luck for us, all of these drawbacks? I wonder how this place operates."
MiMRlsXOpHJMSTDAuw8s1w,Su’s Bowl,Chinese,negative,"Great place if you want to ruin your day. WORST EXPERIENCE ever. First time they gave me my dishes with hair on it, which I understand is just an unintended mistake. So I asked for changing the dish instead of recook one for me. They gave me the exactly same dish in two minutes. Not sure how they did it or if it was still the same one. After I told the waitress the dish I want and she returned to the kitchen. I heard the cook cursing out on me in Chinese. And NO apology at all."
MiMRlsXOpHJMSTDAuw8s1w,Su’s Bowl,Chinese,positive,"Ordered the spicy intestine and lamb soup with vermicelli and Chinese biscuit.  Super delicious and authentic tasting.  I can't believe I found such authentic northern Chinese cuisine in Santa Barbara.  


The spicy intestine was loaded with chili's and it was a very large portion. 

The lamb soup came with a ton of sliced lamb meat and the broth was rich and fragrant.  The biscuit is perfect to use to sop up the soup.  

The man who took my order was also friendly and nice.  

10/10 would recommend"
MiMRlsXOpHJMSTDAuw8s1w,Su’s Bowl,Chinese,negative,"Worse service ever, the waiters do not look at you unless you call them, I ordered take out and they said they put the rice into the bag, but there was no rice when I got home. This place needs to get new waiters instantly."
MiMRlsXOpHJMSTDAuw8s1w,Su’s Bowl,Chinese,negative,"Double post featuring two dishes at Su's Bowl! Given the extremely large menu, it was difficult to pick which items to try but alas these were the chosen ones. Really like everything in the beef noodle soup except the beef; the broth was flavorful and had a mild kick of spice. It was very refreshing with the classic pairing with some poached veggies. The noodles were well made as well, and was springy and soft at the same time. The beef, however, was tough and chewy.

The pork bun was suboptimal, it was salty, oily, and hard to eat. However, the fact that the bun was seared was interesting. Needs some much needed pickled vegetable in the dish."
MiMRlsXOpHJMSTDAuw8s1w,Su’s Bowl,Chinese,positive,"This place is AMAZING!!!
Passed by this place all the time but never stoped by. Finally decided to give it a try and it was bomb!! 
Me and my friend ordered big plate spicy chicken, beef stewed noodle, and lamb soup.
What surprised me was the spicy chicken was so flavorful and the portion was BIG. We were told they made this dish with their secret sauce. The noodles came with it was great too! It's different from the regular noodles you have from the other places, this wide and flat kind bring out the flavor so well. I have to say the noodles literally amazed me!!!
Go try it out guysss!
One thing to keep in mind is the portion is pretty big, so go with friends!!"
Ak_vHsHsYRP928VHVRL_tQ,Panda Express,Chinese,positive,"SO good! Not very healthy, but I can't resist the orange chicken, broccoli beef, and grilled teriyaki chicken (and this is coming from a Chinese girl!)

Here's a tip: each time you order, complete the survey on the back of the receipt for a free entree next time you come. If you keep doing this you'll get an endless cycle of free entrees :)"
Ak_vHsHsYRP928VHVRL_tQ,Panda Express,Chinese,negative,"Love Panda, this location has serious management issues. 2 stars is a stretch, but when you do get the food it is good.

Every time I go, they never have adequate staffing and the staff always complain that they've been short-staffed all day.

One time I went in they had 2 options for entrees (orange chicken and something else) and everything else had a wait, and the line was to the door with about 15 people in line, which is what another reviewer mentioned as well as the posted pictures. And this has happened on multiple occasions. They seem to have 2 people cooking, 1 person washing dishes, and 1 person serving food (maybe 2).

One time there was a line to the door and only 1 poor girl to serve food while there was 1 girl and 1 cook sitting down at the table in clear sight. I understand they legally have to take their lunch, but don't do it in front of a line of customers who are watching you.

I asked for one of the ""premium"" items one time that costs $1 more and they said its frozen and has to be ""prepared"" and would take at least 20 minutes...if I wanted to wait that long, I would have went to a sit-down restaurant.

Please review this place if you experience similar as they hopefully will make some changes."
Ak_vHsHsYRP928VHVRL_tQ,Panda Express,Chinese,negative,The service gets extremely slow once the sun goes down. I guess since they figure they are two hours to closing time they should just have one person helping customers behind the counter? They also let this weird old lady hang around the store and disturb customers. Not a pleasant experience all in all. The only good thing is the TV's they have on the walls.
Ak_vHsHsYRP928VHVRL_tQ,Panda Express,Chinese,positive,"There are lots of people waiting in line! But it's really clean place to eat inside. I had really good experience ordering online, using coupon code and just waited for pick up! That will save your time!!"
Ak_vHsHsYRP928VHVRL_tQ,Panda Express,Chinese,positive,"The food is 5-star.  I do miss the eggplant and tofu, and barb-b-que pork dishes being dropped from the menu."
Ak_vHsHsYRP928VHVRL_tQ,Panda Express,Chinese,negative,"I've lived here for about 5 years but never even ate here because I was scared of the reviews! Solid, quick, but I could def see that many items were low or gone and options were limited as a result. Id recommend getting half chow mein and fried rice as the base!

Portions provided in the combos aren't always even which is a bit disappointing opening your box and seeing mostly a small portion of mostly green beans with 3 pieces of chicken in a 2-3 item combo. Orange chicken is usually on point. The beef with broccoli was alright, slightly sketchy taste but beware of the sauce cause it can spill all over the bag and everywhere and be a no fun why did I choose you mess!

I was surprised to see how long the line can get for this place! I like how they offer you hot sauce when you leave now and wish they had the sweet & sour soup here also!"
Ak_vHsHsYRP928VHVRL_tQ,Panda Express,Chinese,negative,"Many times I ordered a bowl with one entry. But what I got was a bowl full of white rice but very little entry. This is my firsthand experience. I had the similar review on another Panda Express, just because I had the same experience there. I will not choose these places any more."
Ak_vHsHsYRP928VHVRL_tQ,Panda Express,Chinese,negative,"I really miss the tofu and spicy eggplant. I always get half chow mein and half steamed vegetables, mostly very good. But under no circumstances should you even put one of those awful carrots into your mouth. I can't imagine what they have done to the carrots, but they taste like poison.  And maybe cut the broccoli just a little bit more...."
Ak_vHsHsYRP928VHVRL_tQ,Panda Express,Chinese,negative,"Place still doesn't seem to have improved. Constantly low on all items to where if the 2 people in front of you happen to want the same thing you want, then you have to wait for them to make more. Come in too early or too late, they have even fewer items and don't have the lights on. Most recently, I could tell the teriyaki chicken they were cutting for me was very pink and she still put it in the box. They seem to rarely ever have more than 1 person working the food, and sometimes the same person is running back and forth between the food and ringing you up. I would stick to the higher volume mall locations"
Ak_vHsHsYRP928VHVRL_tQ,Panda Express,Chinese,positive,"Love the teriyaki chicken with brown rice after a workout. 36g of protein in the chicken, but skip the high calorie sauce."
Ak_vHsHsYRP928VHVRL_tQ,Panda Express,Chinese,negative,Every time I come here they literally have NOTHING. They really need to make the food when it's half way gone instead of making it when everything is gone. I left after they started filling my box with rice and chow mien since there was no orange or teriyaki chicken ready they said i would have to wait 5 minutes.
Ak_vHsHsYRP928VHVRL_tQ,Panda Express,Chinese,negative,"Yeah, they'll totally mop all around your feet with stinky mop water while you're eating."
Ak_vHsHsYRP928VHVRL_tQ,Panda Express,Chinese,negative,"I give it 3.5 

My go to place when I don't know what to eat. I always get their honey walnut shrimp and sweet fire chicken breast, they're my favorites. 

I honestly think the food here is decent and not as bad as people think it is. They have a variety of entrées to choose from and for a person who is looking for cheap eats, this place is good... but definitely not gourmet though. 

Service is ok. It can be really busy during peak hours and a line usually forms. The servers are kind of slow sometimes and not the friendliest."
Ak_vHsHsYRP928VHVRL_tQ,Panda Express,Chinese,negative,I go there for lunch sometimes and the service is always great ! They are quick to get the line down and the cashiers are always friendly !
Ak_vHsHsYRP928VHVRL_tQ,Panda Express,Chinese,positive,"There are lots of people waiting in line! But it's really clean place to eat inside. I had really good experience ordering online, using coupon code and just waited for pick up! That will save your time!!"
Ak_vHsHsYRP928VHVRL_tQ,Panda Express,Chinese,negative,Served by a blonde white female with the dirtiest nails. It was so disgusting that I had to refuse her service and ask the older Asian lady to attend me. Im horrified by the idea that this woman could have served my lunch with her nails that looked like she had just came from putting an engine in a car. Makes wonder how clean the cook's hands are...
Ak_vHsHsYRP928VHVRL_tQ,Panda Express,Chinese,positive,Mattae was great! Customer service was on point! Couldn't have had a better experience at Panda Express all the guys were working hard to get that line down and customers there food!
Ak_vHsHsYRP928VHVRL_tQ,Panda Express,Chinese,negative,How many ways can you say slow. Not just a little slow like TSA at the airport; I mean so slow you forgot what you ordered by the time they ask you to pay.  Mystery meat and copious amounts of salt. In a single word BAD!
Ak_vHsHsYRP928VHVRL_tQ,Panda Express,Chinese,negative,"I arrived 40 minutes before closing and they took all food off the buffet. The only thing available to order was rice, chow main, and spring rolls. I asked if they had any more food and they told me ""I guess we could cook something if you want .""  So much for customer service. I know it's just food, but still..."
Ak_vHsHsYRP928VHVRL_tQ,Panda Express,Chinese,positive,"I never thought I'd be writing a review for a Panda Express, but it has sincerely become my go-to Asian restaurant that a college student could afford in SB.  All Panda Expresses are the same but I like how I always get $1 off for taking the phone/online survey when ordering a paw plate. $5.49 for a 3 item plate with non-premium entrees. Not too bad... Food for two meals."
Ak_vHsHsYRP928VHVRL_tQ,Panda Express,Chinese,negative,Months later and things still have not improved. I have to change my order because two items are completely empty.
Ak_vHsHsYRP928VHVRL_tQ,Panda Express,Chinese,positive,"Not comparing it to a nicer restaurant, but for a Panda, it's 5/5. 

Servings are very generous especially compared for the excuse of a meal you usually get the the UCen Panda.

Staff is nice and service is relatively expedient. Interior is clean and there is plenty of parking."
Ak_vHsHsYRP928VHVRL_tQ,Panda Express,Chinese,negative,"SLOW.

I know the shift changes and the people who work the front are changing all the time, but I ran into the worst front crew. They we're so slow, the line behind me ran 13 people long. I counted. Not making it up. To further justify what I'm saying, as opposed to a bunch of people just showing up at the same time, I can tell you that it took 4 separate scoops of friend rice before the quantity seemed right to this person's liking.  Just a sample of why that line stacked up."
Ak_vHsHsYRP928VHVRL_tQ,Panda Express,Chinese,negative,"Staff always tries t o up sell me, other than that I love this place when I need a quick lunch. Not gourmet dining though!

oh, yea parkings sucks tho. Park behind OSH if you can."
Ak_vHsHsYRP928VHVRL_tQ,Panda Express,Chinese,positive,"I went back to try Panda Express again.  I hate to give a bad review and leave it at that.

Once again, a few issues.  First, always check your order in the store if you are going to take it out.  On more than one occasion the order was not completed correctly.  Second, plan to spend time there.  Many popular dishes are not kept ready to go.  You have to wait and wait.  While I applaud many restaurants for factoring in waste, sometimes they carry it to excess.  Keep trying!  The recipes are very good, it's just hard to get the really good help today.  I think they're trying to improve."
Ak_vHsHsYRP928VHVRL_tQ,Panda Express,Chinese,positive,Best Panda Express ever. Greeted by everyone when I arrived! Food was good and hot! Thank you!
Ak_vHsHsYRP928VHVRL_tQ,Panda Express,Chinese,negative,"Very slow service- one person running the food service and cashiering.  Four other employees- two actually working, two at break at same time.  Evidently no active management."
Ak_vHsHsYRP928VHVRL_tQ,Panda Express,Chinese,negative,"We are loyal customers here. We've been coming here for 10+yrs as we work in Goleta. 

The past few times we have been disappointed, enough to write a review. It's hard to mess up Panda, but this location has managed to do it. 

The serving size has gradually gotten smaller and smaller and smaller. I used to take food to go. Now I leave hungry. 

It's one very small scoop of your choice (don't choose anything with veggies as you will get 90% veggies and 10% meat). VERY SMALL. 
One time the server put a little bit too much on my plate and she took a few pieces of chicken off!! Ridiculous! The scoops are terrible small lately. 

Also, the pre-packaged teriyaki sauce is awful. If it sits out too long it turns jello-ey. 
And now the sweet and sour sauce is also pre packaged. WHY!?!? 
Nobody likes dipping hot fried Panda in COLD SAUCE!

I will continue to eat here. We miss Astrid!!"
Ak_vHsHsYRP928VHVRL_tQ,Panda Express,Chinese,positive,The staff is awesome and the manager Noah is always friendly and welcoming. I can't go wrong choosing to eat their.
Ak_vHsHsYRP928VHVRL_tQ,Panda Express,Chinese,negative,"My fried rice was dry and crunchy, the wait for Mushroom Chicken was long and the orange chicken was also dry.  So I waited a long time for a lousy meal. What a bummer."
Ak_vHsHsYRP928VHVRL_tQ,Panda Express,Chinese,positive,The staff is extremely nice and helpful.. the food it very on point and very fresh. Great for my daughter and myself!
Ak_vHsHsYRP928VHVRL_tQ,Panda Express,Chinese,negative,"Well what can I say about this particular panda. I've been to plenty and this one is pretty big with lots of seating and the place was clean. Food was good but it normally is unless they don't rotate a fresh batch of whatever you pick. 
Overall good place for quick Chinese food since I still have yet to a tasty Chinese food spot, in the area. So this panda satisfies my craving.

My order was beef and broccoli and Orange chicken. Half fried rice and chow mein"
Ak_vHsHsYRP928VHVRL_tQ,Panda Express,Chinese,negative,"I went back to try Panda Express again.  I hate to give a bad review and leave it at that.

Once again, a few issues.  First, always check your order in the store if you are going to take it out.  On more than one occasion the order was not completed correctly.  Second, plan to spend time there.  Many popular dishes are not kept ready to go.  You have to wait and wait.  While I applaud many restaurants for factoring in waste, sometimes they carry it to excess.  Keep trying!  The recipes are very good, it's just hard to get the really good help today.  Well, we tried PE again, and once again, the excuse for the lack of food is ""we had a rush.""  Someone there doesn't get it.  What's the point of going if they are always out?

They have been critiqued negatively before, but they're not taking it to heart!"
Ak_vHsHsYRP928VHVRL_tQ,Panda Express,Chinese,negative,"Came in 50 minutes before closing time and all they had left was base entrees and fresh orange chicken. My family and I were ready to drop around $50-60 dollars on Panda Express but they refused to make anything fresh or to order for us because they were ""closing soon."" AKA in 50 MINUTES. Now I'm not trying to be a Karen here, but your business could make a lot more money if you just cooked to order when it's late. It's alright because we settled for Taco Bell, but after seeing the reviews on here for this franchise, I can understand that they lack in quality AND customer service. 

Their fried rice is also extremely chewy and hard, and the chow mein was dry. Hopefully someone will start taking care of this business."
Ak_vHsHsYRP928VHVRL_tQ,Panda Express,Chinese,negative,"Always the go to place for fresh food. Today was very disappointing, only 2 employees trying to handle the dinner crowd. Food was not fresh tonite and portions were small. 
Hopefully you hire more people so you continue to stay in business. 
Not very many good places to eat out in Goleta."
Ak_vHsHsYRP928VHVRL_tQ,Panda Express,Chinese,negative,"Closed "" until further notice""

It is fast food so ...

I found the food fresh, good variety, healthy, low fat, very salty. 

The restaurant, tables, and restrooms are plentiful and clean. 

I going down the cafeteria line the staff tends to yell at you about what you want from 10 feet ahead of you. This really hurts the experience because:
1) you don't know what you want because it is yet to far away. 
2) you can't hear because they are screaming at you
3) it raises the tension because the server in front of you is screaming at the person 10 feet behind you. 

It contributes to a hurry and get it done attitude rather that a friendly ""how can I help you"" atmosphere. I am sure these highly compensated employees time is valuable, but not screaming is nice"
Ak_vHsHsYRP928VHVRL_tQ,Panda Express,Chinese,negative,"One of the worst managed restaurants I've ever had the misfortune to use. Open at 10 am and at 11 am have less than half of their entrees cooked. Asked how long for what I wanted and was told 5 minutes.  20 minutes later they hadn't even started it. 

Previously ordered online at 7:40 pm , said it would be 15 minutes. Then at 7:55 they call me and say they weren't doing my order since they were closing at 8 even though their hours were until 9. Then asked if I wanted it for the next day!!!! Then they charged me !!!  I had to call my credit card company to get it reversed. 

This is a management issue"
