business_id,name,category,stars,text
Ak_vHsHsYRP928VHVRL_tQ,Panda Express,Chinese,negative,"I came here today for some good comfort food in the lonely dark ages of isla vista. Instead what I got was some sick, demented kind of prank that turned the land of gumdrop rainforests and chocolate rivers into my worst nightmare. 
I walk in 30 minute line, which is not their fault.
What is their fault is my cream cheese rangoons with no fucking cream cheese in them. I pay a premium for a warm fluffy dollop of cream cheese encapsulated in a crispy puff pastry but what I get is a lukewarm soggy fried ball sack with nothing but a wisp of the creamy cheese that belongs there. This is not ok.
One star for good vibes"
Ak_vHsHsYRP928VHVRL_tQ,Panda Express,Chinese,positive,Jayson was very friendly and helpful. Panda Express in Goleta is lucky to have such a great employee.
Ak_vHsHsYRP928VHVRL_tQ,Panda Express,Chinese,negative,"I will start off by saying I go here 3 - 4 times a month, and have been for the past few years. I keep hoping one day it will get better. Today was officially the last time I go here. 

Customer service is absolutely horrible here. They know who I am when I walk in, and you'd think they'd treat me with some type of respect and be nice. Maybe a 'hey welcome back!' ... I am here once a week. 

They know I get a 3rd entree every time, so the scoops of food are smaller than normal. I watch people get served in front of me with heaping scoops. Come my turn, it is approx 1/2 the amount. One time, I got 'too much' orange chicken, so Phuong put a piece back. Yes, scooped a piece of chicken off of my plate, and back into their bowl... ridiculous. 

The pre packaged teriyaki sauce and COLD sweet and sour, are also a miss. I have to get 3 cups of sweet and sour to equal one cup. I pour all 3 cups into 1. And it still doesn't overflow. 

Today I had my final straw. I asked for a water cup after getting barely enough food to fill me up (yes I got 3 entrees), and Phuong looked at me so confused. I said, 'can I get a cup for water please?' She says, it's in the bag. I said, no? And double checked... she still didn't believe me I didn't have a water cup yet. So she walks around the cash register, completely stopping the flow of traffic, and searches my bag for a water cup... I'm sorry?? What? 

This is the last time I go here. So Phuong and whoever else works here who doesn't like me, enjoy not seeing me ever again. 

With all that being said, Panda has great food if you time it right. Otherwise, you are getting stale orange chicken that is no longer orange. It is brown. 

Thank you for reading my review. And management, if you see this, please do something about it. I am just a single customer I know, but there are plenty of people who are not happy with the service at this location."
Ak_vHsHsYRP928VHVRL_tQ,Panda Express,Chinese,negative,The staff here are very rude.  In particular one guy named Beck who had a horrible attitude toward me and my 4 year old daughter.  After I was treated poorly by the workers here I asked to talk to the manager and Beck told me there is no manager.  Because of how rude the workers are I will never go to this location again.  Also my friend once saw a cockroach in the chow mein here.  Avoid this location.
Ak_vHsHsYRP928VHVRL_tQ,Panda Express,Chinese,negative,"If I could give them zero stars I would. Every time I go there they literally have none of their main items. This place is notorious for asking ""would you like to wait 10 more minutes for fried rice"" lol. Absolutely ridiculous I can't stand that this location. Poor time management tied along with poor quality and small portion sizes.. avoid this location at all costs."
eukRpR47MDH4XXfU_Dul9Q,Madam Lu,Chinese,negative,"I had expected a lot more from Madame Lu's because it had been rated real high. Inside I noticed alot of clutter behind the cashier desk and the buffet is out of site of the seating which I didn't like because I like to see what's going on. I ordered the pork chop suey and it came with fried rice, a wonton and an egg roll. The pork chop suey was so bland. I had to actually add salt and then soy sauce to it. I have never ever had to add salt to Chinese food! The fried rice was disgusting. It was dark brown, greasy, bland and unappetizing. Again with the salt and soy sauce! There were no peas or egg in it. I had expected a much lighter looking rice with bright veggies in it. The won ton had just a little tiny bit of filling in it and the egg roll was mostly cabbage. The egg rolls at Jack in the Box are much better! My mother and I think that they were too lazy to make a fresh new plate and instead got the food from the buffet. The food was not hot and steamy when we got it. It was just warmed as if it had been sitting around. My mom's tea was not hot at all. No one came to check on us until they presented us with the bill. I told the owner/manager that I did not like the food and I wasn't going to pay for mine. I had barely eaten anything. Not even all of the egg roll. She was mad at me. We sat and waited so my mom could get a box to take home to my dad who will eat anything just about, but we were given dirty looks and ignored so we went to pay at the front where​ I said we were waiting for a box but the cashier ignored that request. We will never return there again. I would like to give this place a half of a star instead of a full one. Don't waste your money there."
eukRpR47MDH4XXfU_Dul9Q,Madam Lu,Chinese,positive,"Madame Lu has the best Chinese food. The owner is really nice, the food is great and always comes fast. The lunch buffet is good but the dinner menu is amazing. I would recommend 3 cup chicken and the sizzling rice soup."
eukRpR47MDH4XXfU_Dul9Q,Madam Lu,Chinese,negative,"Place is decent. Portions are a little small for the prices they charge. $10+ for won ton soup that barely gets 4 people a small cup each, and the broth was darker and saltier than it should be. The rest of the food tasted good but again, portions were a little on the small side. 

Service was good. Kept filling our waters and food came out very quick. 

Will have to try out their lunch buffet.

Definitely recommend the Sesame Chicken"
eukRpR47MDH4XXfU_Dul9Q,Madam Lu,Chinese,positive,"Really enjoyed the food here. We order the fried cheese wontons, shrimp fried rice, sesame ginger chicken, and shrimp in the black bean sauce. All the dishes were fantastic and delicious. Everything came out all fresh and hot. The atmosphere and ambiance needs a little work."
eukRpR47MDH4XXfU_Dul9Q,Madam Lu,Chinese,positive,"This has the BEST kung pao chicken in santa barbara, you have it ask for it ""chinese stlye"" but it is legit! I have tried all the other chinese places and this by far has the best dishes!"
eukRpR47MDH4XXfU_Dul9Q,Madam Lu,Chinese,negative,Had a business trip in 2013 and decided to give this place a try. In a nutshell food was great!  BUT came  today expecting to have the same quality taste and the food was not good at all. I ordered the Mongolia beef and the meat was extremely dry and lacked flavor. The fried rice was also extremely dry and hard to chew.
eukRpR47MDH4XXfU_Dul9Q,Madam Lu,Chinese,negative,"We were so disappointed with the food, which was flavorless and in general low quality. The chicken in the dish we had was grisly -- totally a no go for me and the General Tao didn't have enough sauce to go around. We'd rather go to Panda Express for a third of the cost."
eukRpR47MDH4XXfU_Dul9Q,Madam Lu,Chinese,positive,Madam Lu's was amazing I had a great lunch while I was working the service was exceptional
eukRpR47MDH4XXfU_Dul9Q,Madam Lu,Chinese,negative,Good service. Average level food. Quiet place.
eukRpR47MDH4XXfU_Dul9Q,Madam Lu,Chinese,negative,"Don't eat here if you appreciate good food. I dined at this establishment with my family during the lunchtime buffet. Over all; the food was cold, service was odd as there was a worker (not our waitress) that kept staring at our table (she was no-kidding sitting on the table next to us just staring), and the selection was surprisingly limited for a ""buffet"". Dessert was weird as it included canned peaches, flan, jello, and watermelon (not quite the Chinese-food experience). I'll never eat at this establishment again."
eukRpR47MDH4XXfU_Dul9Q,Madam Lu,Chinese,positive,"Madame Lu is the best!  and I'm not just saying that because we share the same last name!  This is authentic Chinese food in the heart of Santa Barbara.  This nice thing is that all us asians know each other and you can always ask them politely to make something off the menu.  They are super accommodating and you can even bring your own fresh fish or whatnot for them to cook for you!
Always do family style and honestly, the menu is way better than the buffet.
My favorites- chicken fried rice, Peking duck, and the lobster in fruit salad.  (We literally will order one fried rice to go to eat later)  Also the mayonnaise shrimp with walnuts and any fish.  Super delicious, friendly staff and owner, and cleanliness!  Come by and let madame Lu show you what great Chinese food tastes like!"
eukRpR47MDH4XXfU_Dul9Q,Madam Lu,Chinese,positive,"We came here about 530.  Kinda a hole in the wall.  I'd guess they only have maybe 16-20 items and none of the pans were full but everything tasted fresh....they do a high turnover in the kitchen so the food doesn't sit out on the line for hours like some places.  Food tasted like someone's Mom was in the kitchen....loving it.  Lots of Asians eating in there and they were eating off the buffet....good sign.  Bathroom was super clean....another good sign.  Heard no spanish in the kitchen, just asian(couldn't pick out the language)....another good sign.  I saved this place to my GPS."
eukRpR47MDH4XXfU_Dul9Q,Madam Lu,Chinese,positive,"I've never been to the restaurant, but have ordered delivery a few times. They are easily the best Chinese food in Santa Barbara that I've had. The sauce is a good blend of sweet and savory, good meat portions, and delicious chow mein (wide rice noodles). Usually very quick delivery and never had any issues. 

Highly recommended."
eukRpR47MDH4XXfU_Dul9Q,Madam Lu,Chinese,positive,"Highly recommend. I ordered beef hot pot, as I have visited Chongqing many times. And the flavor was pretty spot on. Just the right combo of oil, peppers, and spices.  Plus the service was excellent and the restaurant is nicely decorated!"
eukRpR47MDH4XXfU_Dul9Q,Madam Lu,Chinese,positive,"Okay, I do not understand why this restaurant is rated so poorly.  Ever since I waited an hour to order my food at Red Pepper, I was on the prowl for new Chinese restaurant.  Lo and behold, my friend Sara brought me here.  She ordered off the Chinese menu for me and bam! Those dishes were the best dishes I ever had!  I had fish in hot pot (shui zhu yu) and mei kei kai rou (a pork belly dish).  The fish in hot pot was perfect! The more you eat, the more intense the spicy level gets.  The Mei Kei Kai Rou pork was so tender and rich in taste.  When I brought my family here, the pork was the biggest hit and its hard to please my parents!  My dad ate half the pork plate!  I have been introducing my friends to this place so far as well.  All of them have really enjoyed it.  My ex roommate order the curry beef and chow mein...that curry beef was so delicious.  The beef was tender and the appropriate spice level was there.  The curry was delicious and it was spot on.  My best friend ordered the beef stew with noodles.  I had a taste of it and boy, did it take me back to my mom's cooking!  The stew was rich in taste and nothing else needed to be added.  The beef was so tender and delicious.  I haven't had beef like that in such a long time!  Prices here are pricier because IT IS Santa Barbara.  The portions to us were just right.  All of us didn't understand why so many yelpers were complaining about portions.  If you guys want to be fatasses for larger portions then alright.  These complaints about portions make me realize why obesity in America is such an issue.  AHEM!  My advice...Go for the dishes that aren't commonly found in fast food take out menu in Chinese restaurants (ie. Orange Chicken, Sweet and Sour Pork etc.) I once had a deep fried spicy fish dish here and it was the spiciest thing I had in Santa Barbara.  Its not on the menu but TRY.  Be adventurous and go for it!  

P.S....to @Richelle O....if you have a problem with the shark fin soup...SHUT THE F*&CK UP! This is a review for restaurant's experience, not a poster board for you activism or beliefs..  If you have a problem, then don't eat here.  Take it elsewhere and leave yelpers to decide for themselves.  Don't be a downer...not that you already aren't B%$CH."
eukRpR47MDH4XXfU_Dul9Q,Madam Lu,Chinese,negative,Good but you can tell the microwaves in the kitchen are getting a workout! Food was microwave hot and had a taste of being refrigerated and reheated. Big eaters go here for the Buffet.  Left me wondering if there something better!
eukRpR47MDH4XXfU_Dul9Q,Madam Lu,Chinese,positive,"The buffet is really a good deal... me and my husband went there to have lunch n it was a great experience. They have imperial shrimp which is my favorite, orange peel chicken, egg roll, etc.  The hot and sour soup was very good. We will be back."
eukRpR47MDH4XXfU_Dul9Q,Madam Lu,Chinese,negative,"If I could give it zero stars, I would for this experience. We've come here about 4-5 times and had been pretty satisfied with our meals, that's why we went back. This visit was really bad. We ordered the tea smoked duck but they brought us ham/pork. They wrapped it individually in the crepes but the first bite revealed what it was. We even told our waitress that this seems like pork, it smelled like it and even the muscle fibers and fat that ran through the meat was indicative of pork. It tasted like a honey baked ham. She insisted it was duck. Maybe they were out of duck and served us something that could pass as it. Really, it insulted our intelligence. Then, I noticed a short black hair in one of our other dishes. Gross. Not going back."
eukRpR47MDH4XXfU_Dul9Q,Madam Lu,Chinese,negative,Food was just ok. We ordered from the menu and the soup was so so so salty and beef was so over cooked hard.
eukRpR47MDH4XXfU_Dul9Q,Madam Lu,Chinese,negative,"We've been going here for 15 years and have watched it go steadily down hill for the last 6-7.  In fact, we stopped going here regularly and only show up here when we forget how bad the last time was.  Tonight reminded us again that we swore never to come back.  Bad food and bad service.  The worst experience yet and hopefully our last."
eukRpR47MDH4XXfU_Dul9Q,Madam Lu,Chinese,positive,"This is one of our favorite places to eat because of their delicious food but friendly folks as well. We tend not to deviate from our comfort foods (pork hot pot, fish hot pot, pork belly) because they are just so good."
eukRpR47MDH4XXfU_Dul9Q,Madam Lu,Chinese,positive,Their service is pleasant and a little slow. The food is very good and authentic.  4 stars because they do not have Hunan Beef but I will eat there again next time I'm staying in Santa Barbara.
eukRpR47MDH4XXfU_Dul9Q,Madam Lu,Chinese,negative,"This was some of the worst Chinese style food we've had in a long time. The Kung Pao chicken was prepared with bland chili paste and no chili peppers.  It was supposed to contain water chestnuts which they substituted with some cheap white radish.

The cashew chicken was so bad it provided amusement. It was the same base as the Kung Pao (cubed chicken tossed with prepared chili paste) but the vegetables were frozen mixed vegetables; those tiny cubes of carrot with equal parts peas and yellow corn. It was literally just thawed from a frozen mix. And yellow corn does not evoke Chinese traditional cooking.

As we were leaving we saw a table near the entrance piled with fresh green beans ready for stringing, so clearly they do purchase and prepare some fresh vegetables. If you have to eat here be sure to quiz the server on the ingredients in each dish. Perhaps they have one or two menu items they actually prepare fresh each day."
eukRpR47MDH4XXfU_Dul9Q,Madam Lu,Chinese,negative,The manager is super nice and enjoys getting to know her customers. She always comes to see how we are doing. 3 stars because the food is only deserving of 3 stars compared to Asian food in LA.  Lunch buffet is only 10.75!
eukRpR47MDH4XXfU_Dul9Q,Madam Lu,Chinese,negative,"The orange chicken was wayyyyyy, WAY too sweet. I felt sick eating it after a few minutes and simply gave up. 

The rice tastes like what rice should taste like. Nice and sticky in the pot. 

Overal, 2/5."
eukRpR47MDH4XXfU_Dul9Q,Madam Lu,Chinese,positive,"We found Madam Lu's in the AAA guide while on our way to LA and San Diego.  We were handed a very unappealing dinner menu: sweat and sour everything.  So we asked for the Chinese menu.  That did the trick.  

The food was superb.  The owner gossiped in Taiwanese like she were still living in Taiwan.  It's hilarious.  We revisited Madam Lu's a few years later, on the way to SD and on the way back. It still served the same wonderful food.

Remember, ask for the real menu.  Try the noodle soups."
eukRpR47MDH4XXfU_Dul9Q,Madam Lu,Chinese,positive,"Very good food! Very reasonable!
We wanted to go to the Lunch Buffet but we were too late (we came at 2:40.  The Buffet usually closes at 2:30) but they still had Lunch specials which were very reasonable. We had two different kinds of chicken, both were served with an eggroll, a fried wonton,  fried rice and sauces.  It was very delicious and we paid 20$ for all that food. Absolutely amazing! The Service was also very nice and friendly."
eukRpR47MDH4XXfU_Dul9Q,Madam Lu,Chinese,negative,"Not great.  Wouldn't recommend.
Our order was:
Chicken lo-mein.  It was great.
Chicken fried rice.  Also fantastic.
Sesame chicken.  Below average.  Fried but not really much sauce or flavor to speak of.  Reminded me of pre fried chicken pieces we've gotten from Sam's Club.
Orange sauce chicken.  Same as the sesame chicken.  Pretty bland.
Chicken in curry sauce.  It was decent.

Large portions to accommodate the slightly higher than average prices, so decent value proposition."
eukRpR47MDH4XXfU_Dul9Q,Madam Lu,Chinese,negative,Very very unsatisfied with their customer service ! I was very disappointed because I waited 40 mins. In my car for the restaurant to open. Reason why I waited so long was because I had heard good things about this place and I was willing to try it out. The ladies there are so rude and I felt discriminated. To top it off I was from out of town nowhere near Santa Barbara. Crappy place to ever eat at! They need to better their customer service. I for sure will NOT recommend it to any of my friends or family !
eukRpR47MDH4XXfU_Dul9Q,Madam Lu,Chinese,negative,"After reading all the good reviews, we chose this place for dinner. We ordered Three Flavor Soup for $6.96,Twice Cooked Pork for $10.95, and Shrimp with Spinach for $15.95.
The service was excellent, the soup was delicious. The twice Cook Pork was okay but the Shrimps in the ""Shrimps with Spinach"" was not fresh. We wouldn't go back to this restaurant."
eukRpR47MDH4XXfU_Dul9Q,Madam Lu,Chinese,positive,"The food is a awesome. One of the few restaurants in the coast that will do not only vegetarian but vegan as well.
Both the vegan and the meat eater think the food to be the best Chinese food on the central coast."
eukRpR47MDH4XXfU_Dul9Q,Madam Lu,Chinese,positive,"I went here one night on a whim b/c I drive by this place all the time. Honestly, from the outside, it looked like it's probably never busy and more than likely a front of some sort. This place has parking behind it - which is a plus.

I figured since I was being so adventurous - I would order things I normally wouldn't. 

I tried the curry wontons (addictive - came out super hot and crunchy, even my picky eater had some). I about DIED when I tried their Preserved Vegetable and Pork Soup. The soup was flavorful, the vermicelli noodles were perfectly tender (not too hard and not too mushy), and the pork and preserved veggies were a great medley of deliciousness in my mouth. I unfortunately couldn't stop eating the soup (I ordered the large with the intention of having some for lunch the next day). I overate and couldn't even fathom eating my entree.

The entree - was a chow fun - unfortunately - this was a dud. I like my noodles a little dryer - having it super greasy/oily just doesn't make me want to eat it. Maybe it would have been tastier had I ate it at the table instead of saving it for lunch the next day. The noodles were just too wet and greasy for me.

I have since gone back and picked up lunch - very clear that most of their business is done during lunch. The place was PACKED and people were lined up like they were giving food away. I guess lunch buffets really brings people out?!?

Anyways - highly recommend their curry wonton and soup. Their Kung Pao Tofu was a little over spiced for me but I think it would be good for anyone who likes super spicy food. I'm eager to try a few other things from their menu! Yum!"
eukRpR47MDH4XXfU_Dul9Q,Madam Lu,Chinese,positive,"What a special find for Christmas dinner ! Driving down state street on Christmas Day was becoming worrying, mum and I were starving and nothing seemed to be open. Madam Lu caught my eye and I saw the open sign so we went for it. 
Arriving around 430 the staff were setting up for dinner, no big crowds at this point but quite a few people still dining. 

Our server was really awesome, she was well-spoken and confident. The decor was old but cozy, it was just perfect for a hot dinner on a special day. 
The best part about the menu is the amount of vegan options they have ! I would have never expected a Chinese restaurant to be so accommodating to a vegan diet, my mum was stoked. 
I ordered the Beef Basil and my mum ordered the Vegan Kung Pao Chicken. 
My beef basil was so delicious, the onions were to die for and it was so garlicy. My mum liked hers, she didn't rave about it but she ate most of it and took the rest home. 

Closer to 530 the restaurant was completely packed and I totally understand why, it was delicious. Feeling lucky we found this place on a whim !"
eukRpR47MDH4XXfU_Dul9Q,Madam Lu,Chinese,positive,Very good food. The owner takes pride of ownership. The chicken noodle soup is so good. I've seen the kitchen before and it is very clean and organized.
eukRpR47MDH4XXfU_Dul9Q,Madam Lu,Chinese,positive,"Pretty good chinese on upper state street. Have eaten in and ordered for delivery, it has always been good as far as it goes. Quiter setting for a little date night. Owners are friendly as are the staff and the restaraunt is clean and orderly unlike a few of the local spots. Good local reputation overall and track record for good reason."
eukRpR47MDH4XXfU_Dul9Q,Madam Lu,Chinese,positive,"Delicious steamed fish filet with slivered green onions in Chinese  wine sauce, not available everywhere. Good fried wonton. Good fresh noon buffet. Always friendly and will serve you even if near closing time. Interesting decor with original art work."
eukRpR47MDH4XXfU_Dul9Q,Madam Lu,Chinese,negative,"woman in glasses standing in the center of the room and talking loudly in Chinese customers, so I can`t eat my food indigestible when standing over me and say loudly and logo in my ear !! I understand it was the landlady, she was not polite, relaxed and cultured!"
eukRpR47MDH4XXfU_Dul9Q,Madam Lu,Chinese,positive,We love madam lu restaurant! Great food and friendly service...
eukRpR47MDH4XXfU_Dul9Q,Madam Lu,Chinese,negative,No more Madam Lu for me.  I used to think the food was really good here.  But the last order of Orange Chicken (something my kids will eat) and string beans was horrible.  The orange chicken at Panda Express tastes better and is 1/3 the price.  Madam Lu serves chicken that is dry and tasteless.  The green beans were obviously frozen and went straight to the trash.  What a waste of money.  This place is not the same as it used to be.
eukRpR47MDH4XXfU_Dul9Q,Madam Lu,Chinese,positive,"Very good food, but it's all hidden on the Chinese only menu. I'm not Chinese, so I had to show them pictures from Yelp from Madam Lu and Mama Lu's. They were able to make everything i showed them from yelp, which wasn't on the English Chinese menu. Someone should really tell these guys to include some of the items from the Chinese menu on the American menu. For example, I had a light soup with pea shoots, bamboo, pork and enoki mushrooms. It was Delicious but it's not on the English menu."
